{
  "schema_version": 1,
  "id": "jlcpcb",
  "name": "JLCPCB Standard",
  "vendor": "JLCPCB",
  "description": "DFM constraints for JLCPCB standard PCB service. Based on JLCPCB capabilities: 5 mil trace/space (standard), 0.3mm drill, 5 mil annular ring.",
  "layer_counts": [1, 2, 4, 6, 8, 10, 12, 14, 16, 18, 20],
  "trace": {
    "min_width_nm": 127000,
    "min_spacing_nm": 127000,
    "min_width_outer_nm": 127000,
    "min_width_inner_nm": 127000
  },
  "drill": {
    "min_diameter_nm": 200000,
    "min_pth_diameter_nm": 300000,
    "min_npth_diameter_nm": 600000,
    "min_via_drill_nm": 200000,
    "min_hole_to_hole_nm": 300000,
    "aspect_ratio_max": 12.0
  },
  "via": {
    "min_annular_ring_nm": 127000,
    "min_diameter_nm": 454000,
    "min_via_to_via_nm": 254000,
    "min_via_to_trace_nm": 127000
  },
  "soldermask": {
    "min_expansion_nm": 50800,
    "max_expansion_nm": 127000,
    "min_web_nm": 101600,
    "min_opening_nm": 127000
  },
  "silkscreen": {
    "min_width_nm": 152400,
    "min_height_nm": 1000000,
    "min_clearance_nm": 150000
  },
  "board": {
    "min_edge_clearance_nm": 200000,
    "min_board_width_nm": 5000000,
    "min_board_length_nm": 5000000,
    "max_board_width_nm": 400000000,
    "max_board_length_nm": 500000000
  }
}
